{
  "name": "Training_Fabric_Controller",
  "displayedAs": "Training Fabric Controller",
  "description": "Collects health and API performance for an enterprise fabric controller.",
  "appliesTo": "hasCategory(\"Training_Fabric\") && fabric.api.user && fabric.api.pass",
  "searchKeywords": "training,fabric,controller,health,api",
  "technicalNotes": "Single-instance workshop DataSource. Requires the Training Fabric PropertySource.",
  "group": "",
  "type": 0,
  "dataSourceType": 1,
  "collectionMethod": "script",
  "collectionInterval": "5m",
  "multiInstance": false,
  "collectionAttrs": {
    "type": "groovy",
    "content": "import com.santaba.agent.groovy.utils.GroovyScriptHelper as GSH\nimport com.logicmonitor.mod.Snippets\nimport groovy.json.JsonSlurper\n\ndef modLoader = GSH.getInstance(GroovySystem.version)\n    .getScript(\"Snippets\", Snippets.getLoader())\n    .withBinding(getBinding())\ndef httpMod = modLoader.load(\"proto.http\", \"1.0.0\")\ndef emit = modLoader.load(\"lm.emit\", \"1.3.0\")\ndef cacheMod = modLoader.load(\"lm.cache\", \"0.3.1\")\ndef debugMod = modLoader.load(\"lm.debug\", \"2.0.0\")\ndef debug = false\ndef lmDebug = debugMod.create(hostProps, debug, out)\ndef cacheDebug = [LMDebugPrint: { message -> lmDebug.debug(message) }]\ndef cache = cacheMod.cacheSnippetFactory(cacheDebug, \"training-fabric\")\ndef http = httpMod.create(hostProps)\ndef hostname = hostProps.get(\"system.hostname\", \"\").replaceAll('/$', '')\ndef baseUrl = \"https://${hostname}/api/v1\"\ndef user = hostProps.get(\"fabric.api.user\", \"\")\ndef pass = hostProps.get(\"fabric.api.pass\", \"\")\n\nif (!hostname || !user || !pass)\n    return 1\n\ndef token = getToken(cache, http, baseUrl, user, pass, lmDebug)\nif (!token)\n    return 1\ndef response = http.withHeaders(\n    [Authorization: \"Bearer ${token}\", Accept: \"application/json\"]\n).GET(\"${baseUrl}/controller\", 10000, 20000)\nif (response.responseCode == 401) {\n    lmDebug.warn(\"Cached token was rejected; refreshing token\")\n    token = getToken(cache, http, baseUrl, user, pass, lmDebug, true)\n    if (!token)\n        return 1\n    response = http.withHeaders(\n        [Authorization: \"Bearer ${token}\", Accept: \"application/json\"]\n    ).GET(\"${baseUrl}/controller\", 10000, 20000)\n}\nif (response.responseCode >= 400) {\n    lmDebug.error(\"HTTP ${response.responseCode} from controller endpoint\")\n    return 1\n}\n\ndef controller = new JsonSlurper().parseText(response.inputStream.text)\nemit.dp(\"controller_health\", controller.health)\nemit.dp(\"node_count\", controller.node_count)\nemit.dp(\"api_latency_ms\", controller.api_latency_ms)\nreturn 0\n\ndef getToken(cache, http, String baseUrl, String user, String pass, lmDebug, Boolean forceRefresh = false) {\n    if (forceRefresh)\n        cache.cacheRemove(\"accessToken\")\n    def token = cache.cacheGet(\"accessToken\")\n    if (token)\n        return token\n\n    def basic = \"${user}:${pass}\".bytes.encodeBase64().toString()\n    def response = http.withHeaders(\n        [Authorization: \"Basic ${basic}\", Accept: \"application/json\"]\n    ).GET(\"${baseUrl}/auth/token\", 10000, 20000)\n    if (response.responseCode >= 400) {\n        lmDebug.error(\"Authentication failed with HTTP ${response.responseCode}\")\n        return null\n    }\n    def tokenResponse = new JsonSlurper().parseText(response.inputStream.text)\n    token = tokenResponse.access_token\n    def expiresIn = (tokenResponse.expires_in ?: 300) as Integer\n    def cacheTtl = Math.max(1, expiresIn - 60) as Integer\n    cache.cacheSet(\"accessToken\", token, cacheTtl)\n    lmDebug.debug(\"Fetched and cached a new training API token for ${cacheTtl}s\")\n    return token\n}\n"
  },
  "datapoints": [
    {
      "name": "controller_health",
      "description": "Controller health status; 1 is healthy and 0 is unhealthy.",
      "dataType": 7,
      "type": "gauge",
      "interpretMethod": "namevalue",
      "interpretExpr": "controller_health",
      "useValue": "output",
      "maxDigits": 0,
      "noData": "Do not trigger an alert",
      "clearInterval": 0,
      "triggerInterval": 0,
      "statusDisplayNames": []
    },
    {
      "name": "node_count",
      "description": "Number of fabric nodes reported by the controller.",
      "dataType": 7,
      "type": "gauge",
      "interpretMethod": "namevalue",
      "interpretExpr": "node_count",
      "useValue": "output",
      "maxDigits": 0,
      "noData": "Do not trigger an alert",
      "clearInterval": 0,
      "triggerInterval": 0,
      "statusDisplayNames": []
    },
    {
      "name": "api_latency_ms",
      "description": "Controller API response latency in milliseconds.",
      "dataType": 7,
      "type": "gauge",
      "interpretMethod": "namevalue",
      "interpretExpr": "api_latency_ms",
      "useValue": "output",
      "maxDigits": 2,
      "noData": "Do not trigger an alert",
      "clearInterval": 0,
      "triggerInterval": 0,
      "statusDisplayNames": []
    }
  ],
  "graphs": [
    {
      "name": "Controller Overview",
      "title": "Controller Overview",
      "verticalLabel": "Value",
      "min": 0,
      "timeScale": "1day",
      "displayPriority": 1,
      "scale1024": false,
      "rigid": false,
      "lines": [
        {
          "datapointName": "controller_health",
          "legend": "Health",
          "color": "green",
          "type": "line",
          "isVirtual": false
        },
        {
          "datapointName": "node_count",
          "legend": "Nodes",
          "color": "blue",
          "type": "line",
          "isVirtual": false
        },
        {
          "datapointName": "api_latency_ms",
          "legend": "API latency",
          "color": "orange",
          "type": "line",
          "isVirtual": false
        }
      ],
      "datapoints": [
        {
          "name": "controller_health",
          "datapointName": "controller_health",
          "consolidationFn": "average"
        },
        {
          "name": "node_count",
          "datapointName": "node_count",
          "consolidationFn": "average"
        },
        {
          "name": "api_latency_ms",
          "datapointName": "api_latency_ms",
          "consolidationFn": "average"
        }
      ]
    }
  ]
}
