{
  "name": "Training_Fabric_Node",
  "displayedAs": "Training Fabric Node",
  "description": "Discovers and monitors nodes managed by an enterprise fabric controller.",
  "appliesTo": "hasCategory(\"Training_Fabric\") && fabric.api.user && fabric.api.pass",
  "searchKeywords": "training,fabric,node,active discovery",
  "technicalNotes": "BatchScript multi-instance workshop DataSource. Requires the Training Fabric PropertySource.",
  "group": "",
  "type": 0,
  "dataSourceType": 1,
  "collectionMethod": "batchscript",
  "collectionInterval": "5m",
  "multiInstance": true,
  "useWildValueAsUniqueIdentifier": true,
  "collectionAttrs": {
    "type": "groovy",
    "content": "import com.santaba.agent.groovy.utils.GroovyScriptHelper as GSH\nimport com.logicmonitor.mod.Snippets\nimport groovy.json.JsonSlurper\n\ndef modLoader = GSH.getInstance(GroovySystem.version)\n    .getScript(\"Snippets\", Snippets.getLoader())\n    .withBinding(getBinding())\ndef httpMod = modLoader.load(\"proto.http\", \"1.0.0\")\ndef emit = modLoader.load(\"lm.emit\", \"1.3.0\")\ndef cacheMod = modLoader.load(\"lm.cache\", \"0.3.1\")\ndef debugMod = modLoader.load(\"lm.debug\", \"2.0.0\")\ndef debug = false\ndef lmDebug = debugMod.create(hostProps, debug, out)\ndef cacheDebug = [LMDebugPrint: { message -> lmDebug.debug(message) }]\ndef cache = cacheMod.cacheSnippetFactory(cacheDebug, \"training-fabric\")\ndef http = httpMod.create(hostProps)\ndef hostname = hostProps.get(\"system.hostname\", \"\").replaceAll('/$', '')\ndef baseUrl = \"https://${hostname}/api/v1\"\ndef user = hostProps.get(\"fabric.api.user\", \"\")\ndef pass = hostProps.get(\"fabric.api.pass\", \"\")\n\nif (!hostname || !user || !pass)\n    return 1\n\ndef token = getToken(cache, http, baseUrl, user, pass, lmDebug)\nif (!token)\n    return 1\n\ndef headers = [Authorization: \"Bearer ${token}\", Accept: \"application/json\"]\ndef collectionFailed = false\ndatasourceinstanceProps.each { instance, props ->\n    if (collectionFailed)\n        return\n    def wild = props.wildvalue\n    def response = http.withHeaders(headers).GET(\"${baseUrl}/nodes/${wild}\", 10000, 20000)\n    if (response.responseCode >= 400) {\n        lmDebug.error(\"HTTP ${response.responseCode} for node ${wild}\")\n        collectionFailed = true\n        return\n    }\n    def node = new JsonSlurper().parseText(response.inputStream.text)\n    emit.dp(wild, \"health\", node.health)\n    emit.dp(wild, \"cpu_percent\", node.cpu_percent)\n    emit.dp(wild, \"memory_percent\", node.memory_percent)\n    emit.dp(wild, \"interface_count\", node.interface_count)\n    emit.dp(wild, \"error_rate_percent\", node.error_rate_percent)\n}\nreturn collectionFailed ? 1 : 0\n\ndef getToken(cache, http, String baseUrl, String user, String pass, lmDebug) {\n    def token = cache.cacheGet(\"accessToken\")\n    if (token)\n        return token\n\n    def basic = \"${user}:${pass}\".bytes.encodeBase64().toString()\n    def response = http.withHeaders(\n        [Authorization: \"Basic ${basic}\", Accept: \"application/json\"]\n    ).GET(\"${baseUrl}/auth/token\", 10000, 20000)\n    if (response.responseCode >= 400) {\n        lmDebug.error(\"Authentication failed with HTTP ${response.responseCode}\")\n        return null\n    }\n    token = new JsonSlurper().parseText(response.inputStream.text).access_token\n    cache.cacheSet(\"accessToken\", token, 300000)\n    lmDebug.debug(\"Fetched and cached a new training API token\")\n    return token\n}\n"
  },
  "activeDiscovery": {
    "discoveryMethod": "ad_script",
    "enabled": true,
    "discoveryInterval": "60m",
    "groupMethod": "none",
    "deleteInactiveInstances": false,
    "autoDeleteInstances": true,
    "disableDiscoveredInstances": false,
    "showDeletedInstanceDays": 0,
    "filters": [],
    "params": {
      "type": "groovy",
      "content": "import com.santaba.agent.groovy.utils.GroovyScriptHelper as GSH\nimport com.logicmonitor.mod.Snippets\nimport groovy.json.JsonSlurper\n\ndef modLoader = GSH.getInstance(GroovySystem.version)\n    .getScript(\"Snippets\", Snippets.getLoader())\n    .withBinding(getBinding())\ndef httpMod = modLoader.load(\"proto.http\", \"1.0.0\")\ndef emit = modLoader.load(\"lm.emit\", \"1.3.0\")\ndef cacheMod = modLoader.load(\"lm.cache\", \"0.3.1\")\ndef debugMod = modLoader.load(\"lm.debug\", \"2.0.0\")\ndef debug = false\ndef lmDebug = debugMod.create(hostProps, debug, out)\ndef cacheDebug = [LMDebugPrint: { message -> lmDebug.debug(message) }]\ndef cache = cacheMod.cacheSnippetFactory(cacheDebug, \"training-fabric\")\ndef http = httpMod.create(hostProps)\ndef hostname = hostProps.get(\"system.hostname\", \"\").replaceAll('/$', '')\ndef baseUrl = \"https://${hostname}/api/v1\"\ndef user = hostProps.get(\"fabric.api.user\", \"\")\ndef pass = hostProps.get(\"fabric.api.pass\", \"\")\n\nif (!hostname || !user || !pass)\n    return 1\n\ndef token = getToken(cache, http, baseUrl, user, pass, lmDebug)\nif (!token)\n    return 1\n\ndef response = http.withHeaders(\n    [Authorization: \"Bearer ${token}\", Accept: \"application/json\"]\n).GET(\"${baseUrl}/nodes\", 10000, 20000)\nif (response.responseCode >= 400)\n    return 1\n\ndef nodes = new JsonSlurper().parseText(response.inputStream.text)\nnodes.each { node ->\n    emit.instance(node.id, node.name, \"${node.role} at ${node.site}\", [\n        \"auto.role\": node.role,\n        \"auto.site\": node.site\n    ])\n}\nreturn 0\n\ndef getToken(cache, http, String baseUrl, String user, String pass, lmDebug) {\n    def token = cache.cacheGet(\"accessToken\")\n    if (token)\n        return token\n\n    def basic = \"${user}:${pass}\".bytes.encodeBase64().toString()\n    def response = http.withHeaders(\n        [Authorization: \"Basic ${basic}\", Accept: \"application/json\"]\n    ).GET(\"${baseUrl}/auth/token\", 10000, 20000)\n    if (response.responseCode >= 400)\n        return null\n    token = new JsonSlurper().parseText(response.inputStream.text).access_token\n    cache.cacheSet(\"accessToken\", token, 300000)\n    lmDebug.debug(\"Fetched and cached a new training API token\")\n    return token\n}\n"
    }
  },
  "datapoints": [
    {
      "name": "health",
      "description": "Node health status; 1 is healthy and 0 is unhealthy.",
      "dataType": 7,
      "type": "gauge",
      "interpretMethod": "namevalue",
      "interpretExpr": "##WILDVALUE##.health",
      "useValue": "output",
      "maxDigits": 0,
      "noData": "Do not trigger an alert",
      "clearInterval": 0,
      "triggerInterval": 0,
      "statusDisplayNames": []
    },
    {
      "name": "cpu_percent",
      "description": "Node CPU utilization percentage.",
      "dataType": 7,
      "type": "gauge",
      "interpretMethod": "namevalue",
      "interpretExpr": "##WILDVALUE##.cpu_percent",
      "useValue": "output",
      "maxDigits": 2,
      "noData": "Do not trigger an alert",
      "clearInterval": 0,
      "triggerInterval": 0,
      "statusDisplayNames": []
    },
    {
      "name": "memory_percent",
      "description": "Node memory utilization percentage.",
      "dataType": 7,
      "type": "gauge",
      "interpretMethod": "namevalue",
      "interpretExpr": "##WILDVALUE##.memory_percent",
      "useValue": "output",
      "maxDigits": 2,
      "noData": "Do not trigger an alert",
      "clearInterval": 0,
      "triggerInterval": 0,
      "statusDisplayNames": []
    },
    {
      "name": "interface_count",
      "description": "Number of interfaces reported by the node.",
      "dataType": 7,
      "type": "gauge",
      "interpretMethod": "namevalue",
      "interpretExpr": "##WILDVALUE##.interface_count",
      "useValue": "output",
      "maxDigits": 0,
      "noData": "Do not trigger an alert",
      "clearInterval": 0,
      "triggerInterval": 0,
      "statusDisplayNames": []
    },
    {
      "name": "error_rate_percent",
      "description": "Node interface error rate percentage.",
      "dataType": 7,
      "type": "gauge",
      "interpretMethod": "namevalue",
      "interpretExpr": "##WILDVALUE##.error_rate_percent",
      "useValue": "output",
      "maxDigits": 2,
      "noData": "Do not trigger an alert",
      "clearInterval": 0,
      "triggerInterval": 0,
      "statusDisplayNames": []
    }
  ],
  "graphs": [
    {
      "name": "Node Resource Health",
      "title": "Node Resource Health",
      "verticalLabel": "Percent",
      "min": 0,
      "max": 100,
      "timeScale": "1day",
      "displayPriority": 1,
      "scale1024": false,
      "rigid": false,
      "lines": [
        {
          "datapointName": "cpu_percent",
          "legend": "CPU",
          "color": "blue",
          "type": "line",
          "isVirtual": false
        },
        {
          "datapointName": "memory_percent",
          "legend": "Memory",
          "color": "orange",
          "type": "line",
          "isVirtual": false
        },
        {
          "datapointName": "error_rate_percent",
          "legend": "Errors",
          "color": "red",
          "type": "line",
          "isVirtual": false
        }
      ],
      "datapoints": [
        {
          "name": "cpu_percent",
          "datapointName": "cpu_percent",
          "consolidationFn": "average"
        },
        {
          "name": "memory_percent",
          "datapointName": "memory_percent",
          "consolidationFn": "average"
        },
        {
          "name": "error_rate_percent",
          "datapointName": "error_rate_percent",
          "consolidationFn": "average"
        }
      ]
    }
  ]
}
