{
  "name": "Training_Fabric_Node",
  "displayedAs": "Training Fabric Node",
  "description": "Discovers and monitors nodes managed by an enterprise fabric controller.",
  "appliesTo": "hasCategory(\"Training_Fabric\") && fabric.api.user && fabric.api.pass",
  "searchKeywords": "training,fabric,node,active discovery",
  "technicalNotes": "BatchScript multi-instance workshop DataSource. Requires the Training Fabric PropertySource.",
  "group": "",
  "type": 0,
  "dataSourceType": 1,
  "collectionMethod": "batchscript",
  "collectionInterval": "5m",
  "multiInstance": true,
  "useWildValueAsUniqueIdentifier": true,
  "collectionAttrs": {
    "type": "groovy",
    "content": "import groovy.json.JsonSlurper\n\n// Read connection details from the resource instead of hard-coding them.\ndef apiHostname = hostProps.get(\"system.hostname\", \"\").replaceAll('/$', '')\ndef apiBaseUrl = \"https://${apiHostname}/api/v1\"\ndef apiUser = hostProps.get(\"fabric.api.user\", \"\")\ndef apiPassword = hostProps.get(\"fabric.api.pass\", \"\")\n\nif (!apiHostname || !apiUser || !apiPassword)\n    return 1\n\n// Authenticate once before visiting each discovered instance.\ndef token = requestJson(\n    \"${apiBaseUrl}/auth/token\",\n    [Authorization: \"Basic ${basicAuthHeader(apiUser, apiPassword)}\"]\n)\ndef bearer = [Authorization: \"Bearer ${token.access_token}\"]\ndef collectionFailed = false\n\ndatasourceinstanceProps.each { instance, props ->\n    if (collectionFailed)\n        return\n    // The wildvalue links this collection request to one discovered instance.\n    def wild = props.wildvalue\n    try {\n        def node = requestJson(\"${apiBaseUrl}/nodes/${wild}\", bearer)\n        // LAB STEP 1: Uncomment the five output lines and keep the wildvalue on every key.\n        // println \"${wild}.health=${node.health}\"\n        // println \"${wild}.cpu_percent=${node.cpu_percent}\"\n        // println \"${wild}.memory_percent=${node.memory_percent}\"\n        // println \"${wild}.interface_count=${node.interface_count}\"\n        // println \"${wild}.error_rate_percent=${node.error_rate_percent}\"\n    } catch (Exception ignored) {\n        // Do not emit partial metrics when one instance request fails.\n        collectionFailed = true\n    }\n}\nreturn collectionFailed ? 1 : 0\n\n// Helper methods keep the multi-instance collection flow easy to follow.\ndef basicAuthHeader(String user, String password) {\n    return \"${user}:${password}\".bytes.encodeBase64().toString()\n}\n\ndef requestJson(String endpoint, Map headers) {\n    def connection = new URL(endpoint).openConnection()\n    headers.each { key, value -> connection.setRequestProperty(key, value.toString()) }\n    connection.setRequestProperty(\"Accept\", \"application/json\")\n    connection.connectTimeout = 10000\n    connection.readTimeout = 20000\n    if (connection.responseCode >= 400)\n        throw new IllegalStateException(\"HTTP ${connection.responseCode} from ${endpoint}\")\n    return new JsonSlurper().parseText(connection.inputStream.text)\n}\n"
  },
  "activeDiscovery": {
    "discoveryMethod": "ad_script",
    "enabled": true,
    "discoveryInterval": "60m",
    "groupMethod": "none",
    "deleteInactiveInstances": false,
    "autoDeleteInstances": true,
    "disableDiscoveredInstances": false,
    "showDeletedInstanceDays": 0,
    "filters": [
      {
        "attribute": "auto.status",
        "operation": "Equal",
        "value": "online"
      }
    ],
    "params": {
      "type": "groovy",
      "content": "import groovy.json.JsonSlurper\n\n// Read connection details from the resource instead of hard-coding them.\ndef apiHostname = hostProps.get(\"system.hostname\", \"\").replaceAll('/$', '')\ndef apiBaseUrl = \"https://${apiHostname}/api/v1\"\ndef apiUser = hostProps.get(\"fabric.api.user\", \"\")\ndef apiPassword = hostProps.get(\"fabric.api.pass\", \"\")\n\nif (!apiHostname || !apiUser || !apiPassword)\n    return 1\n\n// Authenticate once, then ask the API which node instances exist.\ndef token = requestJson(\n    \"${apiBaseUrl}/auth/token\",\n    [Authorization: \"Basic ${basicAuthHeader(apiUser, apiPassword)}\"]\n)\ndef nodes = requestJson(\n    \"${apiBaseUrl}/nodes\",\n    [Authorization: \"Bearer ${token.access_token}\"]\n)\n\nnodes.each { node ->\n    // The ID is identity; the name is presentation; role and site are context.\n    // Status is emitted as an instance property so the module can filter offline nodes.\n    println \"${node.id}##${node.name}##${node.role} at ${node.site}####auto.role=${node.role}&auto.site=${node.site}&auto.status=${node.status}\"\n}\nreturn 0\n\n// Helper methods keep the discovery flow easy to follow.\ndef basicAuthHeader(String user, String password) {\n    return \"${user}:${password}\".bytes.encodeBase64().toString()\n}\n\ndef requestJson(String endpoint, Map headers) {\n    def connection = new URL(endpoint).openConnection()\n    headers.each { key, value -> connection.setRequestProperty(key, value.toString()) }\n    connection.setRequestProperty(\"Accept\", \"application/json\")\n    connection.connectTimeout = 10000\n    connection.readTimeout = 20000\n    if (connection.responseCode >= 400)\n        throw new IllegalStateException(\"HTTP ${connection.responseCode} from ${endpoint}\")\n    return new JsonSlurper().parseText(connection.inputStream.text)\n}\n"
    }
  },
  "datapoints": [
    {
      "name": "health",
      "description": "Node health status; 1 is healthy and 0 is unhealthy.",
      "dataType": 7,
      "type": "gauge",
      "interpretMethod": "namevalue",
      "interpretExpr": "##WILDVALUE##.health",
      "useValue": "output",
      "maxDigits": 0,
      "noData": "Do not trigger an alert",
      "clearInterval": 0,
      "triggerInterval": 0,
      "statusDisplayNames": []
    },
    {
      "name": "cpu_percent",
      "description": "Node CPU utilization percentage.",
      "dataType": 7,
      "type": "gauge",
      "interpretMethod": "namevalue",
      "interpretExpr": "##WILDVALUE##.cpu_percent",
      "useValue": "output",
      "maxDigits": 2,
      "noData": "Do not trigger an alert",
      "clearInterval": 0,
      "triggerInterval": 0,
      "statusDisplayNames": []
    },
    {
      "name": "memory_percent",
      "description": "Node memory utilization percentage.",
      "dataType": 7,
      "type": "gauge",
      "interpretMethod": "namevalue",
      "interpretExpr": "##WILDVALUE##.memory_percent",
      "useValue": "output",
      "maxDigits": 2,
      "noData": "Do not trigger an alert",
      "clearInterval": 0,
      "triggerInterval": 0,
      "statusDisplayNames": []
    },
    {
      "name": "interface_count",
      "description": "Number of interfaces reported by the node.",
      "dataType": 7,
      "type": "gauge",
      "interpretMethod": "namevalue",
      "interpretExpr": "##WILDVALUE##.interface_count",
      "useValue": "output",
      "maxDigits": 0,
      "noData": "Do not trigger an alert",
      "clearInterval": 0,
      "triggerInterval": 0,
      "statusDisplayNames": []
    },
    {
      "name": "error_rate_percent",
      "description": "Node interface error rate percentage.",
      "dataType": 7,
      "type": "gauge",
      "interpretMethod": "namevalue",
      "interpretExpr": "##WILDVALUE##.error_rate_percent",
      "useValue": "output",
      "maxDigits": 2,
      "noData": "Do not trigger an alert",
      "clearInterval": 0,
      "triggerInterval": 0,
      "statusDisplayNames": []
    }
  ]
}
