{
  "name": "Training_Fabric_Controller",
  "displayedAs": "Training Fabric Controller",
  "description": "Collects health and API performance for an enterprise fabric controller.",
  "appliesTo": "false()",
  "searchKeywords": "training,fabric,controller,health,api",
  "technicalNotes": "Single-instance workshop DataSource. Requires the Training Fabric PropertySource.",
  "group": "",
  "type": 0,
  "dataSourceType": 1,
  "collectionMethod": "script",
  "collectionInterval": "5m",
  "multiInstance": false,
  "collectionAttrs": {
    "type": "groovy",
    "content": "import groovy.json.JsonSlurper\n\n// Resource inputs: read the API host and credentials from resource properties.\ndef apiHostname = hostProps.get(\"system.hostname\", \"\").replaceAll('/$', '')\ndef apiBaseUrl = \"https://${apiHostname}/api/v1\"\ndef apiUser = hostProps.get(\"fabric.api.user\", \"\")\ndef apiPassword = hostProps.get(\"fabric.api.pass\", \"\")\n\nif (!apiHostname || !apiUser || !apiPassword) {\n    out.println(\"LAB CHECK: the resource is missing the workshop connection properties\")\n    return 0\n}\n\n// Main flow: authenticate, request one controller response, and emit datapoints.\ndef token = requestJson(\"${apiBaseUrl}/auth/token\", [Authorization: \"Basic ${basicAuthHeader(apiUser, apiPassword)}\"])\ndef controller = requestJson(\n    \"${apiBaseUrl}/controller\",\n    [Authorization: \"Bearer ${token.access_token}\"]\n)\n\n// LAB STEP 1: Match each API field to a Collector output and datapoint.\n// println \"controller_health=${controller.health}\"\n// println \"node_count=${controller.node_count}\"\n// println \"api_latency_ms=${controller.api_latency_ms}\"\nreturn 0\n\n// Helpers: keep authentication and HTTP details out of the main flow.\ndef basicAuthHeader(String user, String password) {\n    return \"${user}:${password}\".bytes.encodeBase64().toString()\n}\n\ndef requestJson(String endpoint, Map headers) {\n    def connection = new URL(endpoint).openConnection()\n    headers.each { key, value -> connection.setRequestProperty(key, value.toString()) }\n    connection.setRequestProperty(\"Accept\", \"application/json\")\n    connection.connectTimeout = 10000\n    connection.readTimeout = 20000\n    if (connection.responseCode >= 400)\n        throw new IllegalStateException(\"HTTP ${connection.responseCode} from ${endpoint}\")\n    return new JsonSlurper().parseText(connection.inputStream.text)\n}\n"
  },
  "datapoints": [
    {
      "name": "controller_health",
      "description": "Controller health status; 1 is healthy and 0 is unhealthy.",
      "dataType": 7,
      "type": "gauge",
      "interpretMethod": "namevalue",
      "interpretExpr": "controller_health",
      "useValue": "output",
      "maxDigits": 0,
      "noData": "Do not trigger an alert",
      "clearInterval": 0,
      "triggerInterval": 0,
      "statusDisplayNames": []
    },
    {
      "name": "node_count",
      "description": "Number of fabric nodes reported by the controller.",
      "dataType": 7,
      "type": "gauge",
      "interpretMethod": "namevalue",
      "interpretExpr": "node_count",
      "useValue": "output",
      "maxDigits": 0,
      "noData": "Do not trigger an alert",
      "clearInterval": 0,
      "triggerInterval": 0,
      "statusDisplayNames": []
    },
    {
      "name": "api_latency_ms",
      "description": "Controller API response latency in milliseconds.",
      "dataType": 7,
      "type": "gauge",
      "interpretMethod": "namevalue",
      "interpretExpr": "api_latency_ms",
      "useValue": "output",
      "maxDigits": 2,
      "noData": "Do not trigger an alert",
      "clearInterval": 0,
      "triggerInterval": 0,
      "statusDisplayNames": []
    }
  ],
  "graphs": [
    {
      "name": "Controller Overview",
      "title": "Controller Overview",
      "verticalLabel": "Value",
      "min": 0,
      "timeScale": "1day",
      "displayPriority": 1,
      "scale1024": false,
      "rigid": false,
      "lines": [
        {
          "datapointName": "controller_health",
          "legend": "Health",
          "color": "green",
          "type": "line",
          "isVirtual": false
        },
        {
          "datapointName": "node_count",
          "legend": "Nodes",
          "color": "blue",
          "type": "line",
          "isVirtual": false
        },
        {
          "datapointName": "api_latency_ms",
          "legend": "API latency",
          "color": "orange",
          "type": "line",
          "isVirtual": false
        }
      ],
      "datapoints": [
        {
          "name": "controller_health",
          "datapointName": "controller_health",
          "consolidationFn": "average"
        },
        {
          "name": "node_count",
          "datapointName": "node_count",
          "consolidationFn": "average"
        },
        {
          "name": "api_latency_ms",
          "datapointName": "api_latency_ms",
          "consolidationFn": "average"
        }
      ]
    }
  ]
}
