{
  "name": "Training_Fabric_Node",
  "displayedAs": "Training Fabric Node",
  "description": "Discovers and monitors nodes managed by an enterprise fabric controller.",
  "appliesTo": "false()",
  "searchKeywords": "training,fabric,node,active discovery",
  "technicalNotes": "BatchScript multi-instance workshop DataSource. Requires the Training Fabric PropertySource.",
  "group": "",
  "type": 0,
  "dataSourceType": 1,
  "collectionMethod": "batchscript",
  "collectionInterval": "5m",
  "multiInstance": true,
  "useWildValueAsUniqueIdentifier": true,
  "collectionAttrs": {
    "type": "groovy",
    "content": "return 0"
  },
  "activeDiscovery": {
    "discoveryMethod": "ad_script",
    "enabled": true,
    "discoveryInterval": "60m",
    "groupMethod": "none",
    "deleteInactiveInstances": false,
    "autoDeleteInstances": true,
    "disableDiscoveredInstances": false,
    "showDeletedInstanceDays": 0,
    "filters": [],
    "params": {
      "type": "groovy",
      "content": "import groovy.json.JsonSlurper\n\n// Resource inputs: read the API host and credentials from resource properties.\ndef apiHostname = hostProps.get(\"system.hostname\", \"\").replaceAll('/$', '')\ndef apiBaseUrl = \"https://${apiHostname}/api/v1\"\ndef apiUser = hostProps.get(\"fabric.api.user\", \"\")\ndef apiPassword = hostProps.get(\"fabric.api.pass\", \"\")\n\nif (!apiHostname || !apiUser || !apiPassword) {\n    out.println(\"LAB CHECK: the resource is missing the workshop connection properties\")\n    return 0\n}\n\n// Main flow: authenticate, request the node list, and emit instances.\ndef token = requestJson(\"${apiBaseUrl}/auth/token\", [Authorization: \"Basic ${basicAuthHeader(apiUser, apiPassword)}\"])\ndef nodes = requestJson(\n    \"${apiBaseUrl}/nodes\",\n    [Authorization: \"Bearer ${token.access_token}\"]\n)\n\nnodes.each { node ->\n    // LAB STEP 1: ID is identity, name is presentation, and role/site/status are ILPs.\n    // Include auto.status so Active Discovery can later keep only online nodes.\n    // println \"${node.id}##${node.name}##${node.role} at ${node.site}####auto.role=${node.role}&auto.site=${node.site}&auto.status=${node.status}\"\n}\nreturn 0\n\n// Helpers: keep authentication and HTTP details out of the main flow.\ndef basicAuthHeader(String user, String password) {\n    return \"${user}:${password}\".bytes.encodeBase64().toString()\n}\n\ndef requestJson(String endpoint, Map headers) {\n    def connection = new URL(endpoint).openConnection()\n    headers.each { key, value -> connection.setRequestProperty(key, value.toString()) }\n    connection.setRequestProperty(\"Accept\", \"application/json\")\n    connection.connectTimeout = 10000\n    connection.readTimeout = 20000\n    if (connection.responseCode >= 400)\n        throw new IllegalStateException(\"HTTP ${connection.responseCode} from ${endpoint}\")\n    return new JsonSlurper().parseText(connection.inputStream.text)\n}\n"
    }
  },
  "datapoints": [
    {
      "name": "health",
      "description": "Node health status; 1 is healthy and 0 is unhealthy.",
      "dataType": 7,
      "type": "gauge",
      "interpretMethod": "namevalue",
      "interpretExpr": "##WILDVALUE##.health",
      "useValue": "output",
      "maxDigits": 0,
      "noData": "Do not trigger an alert",
      "clearInterval": 0,
      "triggerInterval": 0,
      "statusDisplayNames": []
    },
    {
      "name": "cpu_percent",
      "description": "Node CPU utilization percentage.",
      "dataType": 7,
      "type": "gauge",
      "interpretMethod": "namevalue",
      "interpretExpr": "##WILDVALUE##.cpu_percent",
      "useValue": "output",
      "maxDigits": 2,
      "noData": "Do not trigger an alert",
      "clearInterval": 0,
      "triggerInterval": 0,
      "statusDisplayNames": []
    },
    {
      "name": "memory_percent",
      "description": "Node memory utilization percentage.",
      "dataType": 7,
      "type": "gauge",
      "interpretMethod": "namevalue",
      "interpretExpr": "##WILDVALUE##.memory_percent",
      "useValue": "output",
      "maxDigits": 2,
      "noData": "Do not trigger an alert",
      "clearInterval": 0,
      "triggerInterval": 0,
      "statusDisplayNames": []
    },
    {
      "name": "interface_count",
      "description": "Number of interfaces reported by the node.",
      "dataType": 7,
      "type": "gauge",
      "interpretMethod": "namevalue",
      "interpretExpr": "##WILDVALUE##.interface_count",
      "useValue": "output",
      "maxDigits": 0,
      "noData": "Do not trigger an alert",
      "clearInterval": 0,
      "triggerInterval": 0,
      "statusDisplayNames": []
    },
    {
      "name": "error_rate_percent",
      "description": "Node interface error rate percentage.",
      "dataType": 7,
      "type": "gauge",
      "interpretMethod": "namevalue",
      "interpretExpr": "##WILDVALUE##.error_rate_percent",
      "useValue": "output",
      "maxDigits": 2,
      "noData": "Do not trigger an alert",
      "clearInterval": 0,
      "triggerInterval": 0,
      "statusDisplayNames": []
    }
  ]
}
