{
  "name": "Training_Fabric_Controller",
  "displayedAs": "Training Fabric Controller",
  "description": "Collects health and API performance for an enterprise fabric controller.",
  "appliesTo": "hasCategory(\"Training_Fabric\") && fabric.api.user && fabric.api.pass",
  "searchKeywords": "training,fabric,controller,health,api",
  "technicalNotes": "Single-instance workshop DataSource. Requires the Training Fabric PropertySource.",
  "group": "",
  "type": 0,
  "dataSourceType": 1,
  "collectionMethod": "script",
  "collectionInterval": "5m",
  "multiInstance": false,
  "collectionAttrs": {
    "type": "groovy",
    "content": "import com.santaba.agent.groovy.utils.GroovyScriptHelper as GSH\nimport com.logicmonitor.mod.Snippets\nimport groovy.json.JsonSlurper\n\ndef modLoader = GSH.getInstance(GroovySystem.version)\n    .getScript(\"Snippets\", Snippets.getLoader())\n    .withBinding(getBinding())\ndef emit = modLoader.load(\"lm.emit\", \"1.3.0\")\ndef hostname = hostProps.get(\"system.hostname\", \"\").replaceAll('/$', '')\ndef baseUrl = \"https://${hostname}/api/v1\"\ndef user = hostProps.get(\"fabric.api.user\", \"\")\ndef pass = hostProps.get(\"fabric.api.pass\", \"\")\n\nif (!hostname || !user || !pass)\n    return 1\n\ndef token = readJson(\"${baseUrl}/auth/token\", [Authorization: \"Basic ${basicAuth(user, pass)}\"])\ndef controller = readJson(\n    \"${baseUrl}/controller\",\n    [Authorization: \"Bearer ${token.access_token}\"]\n)\n\nemit.dp(\"controller_health\", controller.health)\nemit.dp(\"node_count\", controller.node_count)\nemit.dp(\"api_latency_ms\", controller.api_latency_ms)\nreturn 0\n\ndef basicAuth(String user, String pass) {\n    return \"${user}:${pass}\".bytes.encodeBase64().toString()\n}\n\ndef readJson(String endpoint, Map headers) {\n    def connection = new URL(endpoint).openConnection()\n    headers.each { key, value -> connection.setRequestProperty(key, value.toString()) }\n    connection.setRequestProperty(\"Accept\", \"application/json\")\n    connection.connectTimeout = 10000\n    connection.readTimeout = 20000\n    if (connection.responseCode >= 400)\n        throw new IllegalStateException(\"HTTP ${connection.responseCode} from ${endpoint}\")\n    return new JsonSlurper().parseText(connection.inputStream.text)\n}\n"
  },
  "datapoints": [
    {
      "name": "controller_health",
      "description": "Controller health status; 1 is healthy and 0 is unhealthy.",
      "dataType": 7,
      "type": "gauge",
      "interpretMethod": "namevalue",
      "interpretExpr": "controller_health",
      "useValue": "output",
      "maxDigits": 0,
      "noData": "Do not trigger an alert",
      "clearInterval": 0,
      "triggerInterval": 0,
      "statusDisplayNames": []
    },
    {
      "name": "node_count",
      "description": "Number of fabric nodes reported by the controller.",
      "dataType": 7,
      "type": "gauge",
      "interpretMethod": "namevalue",
      "interpretExpr": "node_count",
      "useValue": "output",
      "maxDigits": 0,
      "noData": "Do not trigger an alert",
      "clearInterval": 0,
      "triggerInterval": 0,
      "statusDisplayNames": []
    },
    {
      "name": "api_latency_ms",
      "description": "Controller API response latency in milliseconds.",
      "dataType": 7,
      "type": "gauge",
      "interpretMethod": "namevalue",
      "interpretExpr": "api_latency_ms",
      "useValue": "output",
      "maxDigits": 2,
      "noData": "Do not trigger an alert",
      "clearInterval": 0,
      "triggerInterval": 0,
      "statusDisplayNames": []
    }
  ],
  "graphs": [
    {
      "name": "Controller Overview",
      "title": "Controller Overview",
      "verticalLabel": "Value",
      "min": 0,
      "timeScale": "1day",
      "displayPriority": 1,
      "scale1024": false,
      "rigid": false,
      "lines": [
        {
          "datapointName": "controller_health",
          "legend": "Health",
          "color": "green",
          "type": "line",
          "isVirtual": false
        },
        {
          "datapointName": "node_count",
          "legend": "Nodes",
          "color": "blue",
          "type": "line",
          "isVirtual": false
        },
        {
          "datapointName": "api_latency_ms",
          "legend": "API latency",
          "color": "orange",
          "type": "line",
          "isVirtual": false
        }
      ],
      "datapoints": [
        {
          "name": "controller_health",
          "datapointName": "controller_health",
          "consolidationFn": "average"
        },
        {
          "name": "node_count",
          "datapointName": "node_count",
          "consolidationFn": "average"
        },
        {
          "name": "api_latency_ms",
          "datapointName": "api_latency_ms",
          "consolidationFn": "average"
        }
      ]
    }
  ]
}
